{
  "affect_scenes": [],
  "claims": [
    {
      "canonical_key": "test:ct_abdomen",
      "claim_id": "C01",
      "item_id": null,
      "kind": "decoy",
      "probe": "a CT scan of the abdomen",
      "text": "the doctor ordered a CT scan of the abdomen"
    },
    {
      "canonical_key": "advice:own_towel",
      "claim_id": "C02",
      "item_id": "I09",
      "kind": "present",
      "probe": null,
      "text": "the doctor said: Use your own towel and wash your hands often"
    },
    {
      "canonical_key": "med:levocetirizine",
      "claim_id": "C03",
      "item_id": "I03",
      "kind": "present",
      "probe": null,
      "text": "the doctor prescribed levocetirizine"
    },
    {
      "canonical_key": "ref:ophthalmology",
      "claim_id": "C04",
      "item_id": "I08",
      "kind": "present",
      "probe": null,
      "text": "the doctor referred to I am also referring you to the eye clinic if it does not improve"
    },
    {
      "canonical_key": "med:moxifloxacin eye drops",
      "claim_id": "C05",
      "item_id": "I02",
      "kind": "present",
      "probe": null,
      "text": "the doctor prescribed moxifloxacin eye drops"
    },
    {
      "canonical_key": "dx:red_eye",
      "claim_id": "C06",
      "item_id": "I01",
      "kind": "present",
      "probe": null,
      "text": "the doctor said: I think this is infective conjunctivitis, because both eyes are sticky with normal vision and a clear cornea"
    },
    {
      "canonical_key": "med:cetirizine",
      "claim_id": "C07",
      "item_id": "I07",
      "kind": "present",
      "probe": null,
      "text": "the doctor prescribed cetirizine"
    },
    {
      "canonical_key": "drug:insulin_glargine",
      "claim_id": "C08",
      "item_id": null,
      "kind": "decoy",
      "probe": "insulin glargine",
      "text": "the doctor prescribed insulin glargine"
    }
  ],
  "codeswitch_lang": "hi",
  "language_mode": "cs",
  "metadata_variants": [
    {
      "description": "correct login and enrolled (default)",
      "enrolled_pseudo_doctor_ids": [
        "PD01",
        "PD02",
        "PD03",
        "PD04",
        "PD05",
        "PD06",
        "PD07",
        "PD08",
        "PD09",
        "PD10",
        "PD11",
        "PD12",
        "PD13",
        "PD14",
        "PD15",
        "PD16",
        "PD17",
        "PD18",
        "PD19",
        "PD20",
        "PD21",
        "PD22",
        "PD23",
        "PD24",
        "PD25",
        "PD26",
        "PD27",
        "PD28",
        "PD29",
        "PD30",
        "PD31",
        "PD32"
      ],
      "logged_in_pseudo_doctor_id": "PD01",
      "login_coverage": {
        "end_frac": 1.0,
        "start_frac": 0.0
      },
      "variant_id": "v1"
    },
    {
      "description": "wrong pseudo-doctor logged in",
      "enrolled_pseudo_doctor_ids": [
        "PD01",
        "PD02",
        "PD03",
        "PD04",
        "PD05",
        "PD06",
        "PD07",
        "PD08",
        "PD09",
        "PD10",
        "PD11",
        "PD12",
        "PD13",
        "PD14",
        "PD15",
        "PD16",
        "PD17",
        "PD18",
        "PD19",
        "PD20",
        "PD21",
        "PD22",
        "PD23",
        "PD24",
        "PD25",
        "PD26",
        "PD27",
        "PD28",
        "PD29",
        "PD30",
        "PD31",
        "PD32"
      ],
      "logged_in_pseudo_doctor_id": "PD05",
      "login_coverage": {
        "end_frac": 1.0,
        "start_frac": 0.0
      },
      "variant_id": "v2"
    },
    {
      "description": "treating pseudo-doctor not enrolled",
      "enrolled_pseudo_doctor_ids": [
        "PD02",
        "PD03",
        "PD04",
        "PD05",
        "PD06",
        "PD07",
        "PD08",
        "PD09",
        "PD10",
        "PD11",
        "PD12",
        "PD13",
        "PD14",
        "PD15",
        "PD16",
        "PD17",
        "PD18",
        "PD19",
        "PD20",
        "PD21",
        "PD22",
        "PD23",
        "PD24",
        "PD25",
        "PD26",
        "PD27",
        "PD28",
        "PD29",
        "PD30",
        "PD31",
        "PD32"
      ],
      "logged_in_pseudo_doctor_id": "PD01",
      "login_coverage": {
        "end_frac": 1.0,
        "start_frac": 0.0
      },
      "variant_id": "v3"
    },
    {
      "description": "no login for the slot",
      "enrolled_pseudo_doctor_ids": [
        "PD01",
        "PD02",
        "PD03",
        "PD04",
        "PD05",
        "PD06",
        "PD07",
        "PD08",
        "PD09",
        "PD10",
        "PD11",
        "PD12",
        "PD13",
        "PD14",
        "PD15",
        "PD16",
        "PD17",
        "PD18",
        "PD19",
        "PD20",
        "PD21",
        "PD22",
        "PD23",
        "PD24",
        "PD25",
        "PD26",
        "PD27",
        "PD28",
        "PD29",
        "PD30",
        "PD31",
        "PD32"
      ],
      "logged_in_pseudo_doctor_id": null,
      "login_coverage": null,
      "variant_id": "v4"
    },
    {
      "description": "login covers only part of the window",
      "enrolled_pseudo_doctor_ids": [
        "PD01",
        "PD02",
        "PD03",
        "PD04",
        "PD05",
        "PD06",
        "PD07",
        "PD08",
        "PD09",
        "PD10",
        "PD11",
        "PD12",
        "PD13",
        "PD14",
        "PD15",
        "PD16",
        "PD17",
        "PD18",
        "PD19",
        "PD20",
        "PD21",
        "PD22",
        "PD23",
        "PD24",
        "PD25",
        "PD26",
        "PD27",
        "PD28",
        "PD29",
        "PD30",
        "PD31",
        "PD32"
      ],
      "logged_in_pseudo_doctor_id": "PD01",
      "login_coverage": {
        "end_frac": 0.6,
        "start_frac": 0.0
      },
      "variant_id": "v5"
    }
  ],
  "notes": {
    "est_other_voice_share_of_label": 0.086,
    "merged_label": "L0",
    "merged_other_role": "other_clinician",
    "merged_other_speaker_id": "S3",
    "patient_attender_fdr_rule": false
  },
  "pdqi9_plan": null,
  "planted_items": [
    {
      "affirmed_patient_raised": false,
      "attributes": [
        {
          "context_turn_ids": [],
          "forbidden_values": [],
          "name": "content",
          "relay_turn_ids": [],
          "surface": "I think this is infective conjunctivitis, because both eyes are sticky with normal vision and a clear cornea",
          "turn_ids": [
            "T014"
          ],
          "value": "dx:red_eye"
        }
      ],
      "canonical_key": "dx:red_eye",
      "category": "diagnosis",
      "emphasis": {
        "repeat_count": 1,
        "stressed": false
      },
      "is_order": false,
      "item_id": "I01",
      "kind": "diagnosis",
      "pdqi_defect": false,
      "priority_rank": null,
      "stances": [],
      "strength": "firm",
      "trap": null
    },
    {
      "affirmed_patient_raised": false,
      "attributes": [
        {
          "context_turn_ids": [],
          "forbidden_values": [],
          "name": "drug",
          "relay_turn_ids": [],
          "surface": "moxifloxacin eye drops",
          "turn_ids": [
            "T015"
          ],
          "value": "moxifloxacin eye drops"
        },
        {
          "context_turn_ids": [],
          "forbidden_values": [],
          "name": "strength",
          "relay_turn_ids": [],
          "surface": "0.5 percent",
          "turn_ids": [
            "T015"
          ],
          "value": "0.5 percent"
        },
        {
          "context_turn_ids": [],
          "forbidden_values": [],
          "name": "dose",
          "relay_turn_ids": [],
          "surface": "ek boond",
          "turn_ids": [
            "T015"
          ],
          "value": "1drop"
        },
        {
          "context_turn_ids": [],
          "forbidden_values": [],
          "name": "route",
          "relay_turn_ids": [],
          "surface": "dono aankh mein",
          "turn_ids": [
            "T015"
          ],
          "value": "EYE"
        },
        {
          "context_turn_ids": [],
          "forbidden_values": [],
          "name": "frequency",
          "relay_turn_ids": [],
          "surface": "din mein teen baar",
          "turn_ids": [
            "T015"
          ],
          "value": "TID"
        },
        {
          "context_turn_ids": [],
          "forbidden_values": [],
          "name": "duration",
          "relay_turn_ids": [],
          "surface": "paanch din tak",
          "turn_ids": [
            "T015"
          ],
          "value": "5d"
        },
        {
          "context_turn_ids": [],
          "forbidden_values": [],
          "name": "instruction",
          "relay_turn_ids": [],
          "surface": "haath dhone ke baad",
          "turn_ids": [
            "T015"
          ],
          "value": "wash_hands"
        }
      ],
      "canonical_key": "med:moxifloxacin eye drops",
      "category": "medicine_instruction",
      "emphasis": {
        "repeat_count": 1,
        "stressed": false
      },
      "is_order": true,
      "item_id": "I02",
      "kind": "medicine",
      "pdqi_defect": false,
      "priority_rank": null,
      "stances": [],
      "strength": "firm",
      "trap": null
    },
    {
      "affirmed_patient_raised": false,
      "attributes": [
        {
          "context_turn_ids": [],
          "forbidden_values": [],
          "name": "drug",
          "relay_turn_ids": [],
          "surface": "levocetirizine",
          "turn_ids": [
            "T016"
          ],
          "value": "levocetirizine"
        },
        {
          "context_turn_ids": [],
          "forbidden_values": [],
          "name": "strength",
          "relay_turn_ids": [],
          "surface": "5 mg",
          "turn_ids": [
            "T016"
          ],
          "value": "5 mg"
        },
        {
          "context_turn_ids": [],
          "forbidden_values": [],
          "name": "dose",